Título,ID,Taxa de Abertura,Clicks,Data de Envio,Data Consulta,Qtd Enviados,url
AIQON | Podemos falar sobre cibersegurança?,0d75344e64,0.2926,0.0296,2026-01-20,2026-02-02,3995,https://us19.campaign-archive.com/?u=69b240eacdf74b2178df77d5b&id=0d75344e64
"AIQON | *|FNAME|*, posso reservar o seu lugar?",cca802357b,0.2919,0.0062,2026-02-04,2026-02-11,5279,https://mailchi.mp/aiqon/webinar-portfolio-3
"AIQON | *|FNAME|*, posso reservar o seu lugar?",214dd8d96d,0.2548,0.0305,2026-01-27,2026-03-02,1600,https://mailchi.mp/aiqon/webinar-portfolio-2
O custo oculto do risco cibernético: você o quantifica?,cc635261a7,0.3958,0.0833,2026-03-04,2026-03-11,518,https://mailchi.mp/aiqon/5cjhscnmpr
SOC Industrial: Visibilidade unificada para TI e OT,5780a41808,0.25,0.0227,2026-03-04,2026-03-11,186,https://mailchi.mp/aiqon/e6bxruh5z6
Licitações Públicas: Seu portfólio atende às novas exigências de segurança?,32051476fd,0.5556,0.0556,2026-03-04,2026-03-11,166,https://mailchi.mp/aiqon/f4iia7k7fp
BACEN: Sua empresa está realmente em conformidade?,43c8f5fdf9,0.3036,0.059500000000000004,2026-03-04,2026-03-11,367,https://mailchi.mp/aiqon/r1z9ogbd80
[URGENTE] O Syxsense tem atualizações importantes!,5f841cea48,0.4362,0.1509,2026-03-04,2026-03-11,18,https://mailchi.mp/aiqon/gerencie-qualquer-dispositivo-em-segundos-sem-vpn-14181443
Ransomware: A segurança dos pacientes em risco no seu hospital?,54e2d37c3b,0.3125,0.015600000000000001,2026-03-05,2026-03-12,98,https://mailchi.mp/aiqon/oi3fkdpwim
Quanto custa 1 hora da sua produção parada?,1bd1a29452,0.3583,0.0125,2026-03-05,2026-03-12,178,https://mailchi.mp/aiqon/82m8rxsu09
[URGENTE] Mudanças do BACEN Já Estão em Vigor!,835847ca93,0.3333,0.0,2026-03-05,2026-03-12,631,https://mailchi.mp/aiqon/urgente-mudanas-do-bacen-j-esto-em-vigor
Auditoria TCU: Agilize seus relatórios e reduza riscos.,cab18ce12b,0.3471,0.0356,2026-03-06,2026-03-13,65,https://mailchi.mp/aiqon/7pshjixixw
Agilidade e Segurança: Shift-Left para suas APIs no CI/CD,d7c7f5b793,0.5,0.0,2026-03-06,2026-03-13,254,https://mailchi.mp/aiqon/o1s5wasvy8
Sua Produção OT Está Realmente Segura?,990fceebe9,0.2,0.0,2026-03-06,2026-03-13,6,https://mailchi.mp/aiqon/ri4rlgzn6u
Seu Backup Realmente Funciona na Hora H?,b201a27fd5,0.2667,0.0,2026-03-06,2026-03-13,52,https://mailchi.mp/aiqon/z4gn2nhbvb
AIQON | *|EMPRESA|* - [LEMBRETE] Atualização Cadastral: Emissão de Notas Fiscais,59e7ab23d8,0.3,0.1082,2026-03-09,2026-03-16,2,https://mailchi.mp/aiqon/aiqon-atualizao-cadastral-emisso-de-notas-fiscais-14181470
AIQON | *|EMPRESA|* - [URGENTE] Atualização Cadastral: Emissão de Notas Fiscais,964e911a93,0.3154,0.023,2026-03-09,2026-03-16,15,https://mailchi.mp/aiqon/aiqon-atualizao-cadastral-emisso-de-notas-fiscais-14181469
Receita recorrente em cibersegurança parece um bicho de sete cabeças?,4c93d270a5,0.0,0.0,2026-03-09,2026-03-16,721,https://us19.campaign-archive.com/?u=69b240eacdf74b2178df77d5b&id=4c93d270a5
Produção parada? Proteja seu chão de fábrica (TI/OT),8517f4aaaa,0.1333,0.0,2026-03-09,2026-03-16,2,https://us19.campaign-archive.com/?u=69b240eacdf74b2178df77d5b&id=8517f4aaaa
Seu hospital está pronto para a LGPD?,f57a565556,0.0,0.0,2026-03-09,2026-03-16,16,https://us19.campaign-archive.com/?u=69b240eacdf74b2178df77d5b&id=f57a565556
Segurança de APIs no Open Banking: Protegendo o Setor Financeiro,95e114e6e5,0.32770000000000005,0.13449999999999998,2026-03-10,2026-03-17,1,https://us19.campaign-archive.com/?u=69b240eacdf74b2178df77d5b&id=95e114e6e5
Ransomware em Hospitais: Seus Dados Estão Realmente Protegidos?,563606706b,0.1957,0.0435,2026-03-10,2026-03-17,5370,https://us19.campaign-archive.com/?u=69b240eacdf74b2178df77d5b&id=563606706b
Transforme o 'Risco Cibernético' em Números para o Conselho,671a4a7e9e,0.0,0.0,2026-03-11,2026-03-18,502,https://us19.campaign-archive.com/?u=69b240eacdf74b2178df77d5b&id=671a4a7e9e
"APIs velozes, seguras e sem dores de cabeça?",9c48842672,0.2797,0.0339,2026-03-13,2026-03-20,242,https://us19.campaign-archive.com/?u=69b240eacdf74b2178df77d5b&id=9c48842672
Seu último backup te deixaria na mão?,9b82e78cd6,0.3956,0.1319,2026-03-13,2026-03-20,46,https://us19.campaign-archive.com/?u=69b240eacdf74b2178df77d5b&id=9b82e78cd6
APIs bancárias seguras: um diferencial competitivo,5f3df6cd44,0.3761,0.1545,2026-03-17,2026-03-24,1,https://us19.campaign-archive.com/?u=69b240eacdf74b2178df77d5b&id=5f3df6cd44
Segurança de TI: Supere a sobrecarga com Inteligência Artificial,cf372622e1,0.3556,0.0222,2026-03-17,2026-03-24,120,https://mailchi.mp/aiqon/ere7zvjw2x
Seu hospital está protegido contra ransomware?,260e35be4b,0.2407,0.018500000000000003,2026-03-17,2026-03-24,92,https://us19.campaign-archive.com/?u=69b240eacdf74b2178df77d5b&id=260e35be4b
AIQON: Otimize a Aquisição de Cibersegurança Governamental,b71ed4a734,0.0,0.0,2026-03-17,2026-03-24,5,https://us19.campaign-archive.com/?u=69b240eacdf74b2178df77d5b&id=b71ed4a734
BACEN exposto? Evite multas e proteja sua reputação,30e7a775c3,0.0652,0.0217,2026-03-18,2026-03-25,348,https://us19.campaign-archive.com/?u=69b240eacdf74b2178df77d5b&id=30e7a775c3
Dificuldade em monitorar redes OT sem parar a produção?,ca90710754,0.2324,0.0652,2026-03-18,2026-03-25,57,https://mailchi.mp/aiqon/oulnj59j2u
Garantindo a Operação Ininterrupta e a Resiliência de Dados do Seu Hospital,8a23311541,0.2182,0.0545,2026-03-19,2026-03-26,91,https://mailchi.mp/aiqon/xo0sq8fikn
R$ 100 milhões e um alerta: o que o caso do BTG nos ensina sobre APIs,427e3b1aff,0.0,0.0,2026-03-24,2026-03-27,607,https://mailchi.mp/aiqon/r-100-milhes-e-um-alerta-o-que-o-caso-do-btg-nos-ensina-sobre-apis
Continuidade do atendimento em risco? Teste sua resiliência de dados!,7836fa672b,0.3889,0.0556,2026-03-27,2026-03-27,46,https://us19.campaign-archive.com/?u=69b240eacdf74b2178df77d5b&id=7836fa672b
"Netwrix: Sua Política de Senhas Aplicada, Sem Complicações.",69c05889bf,0.0,0.0,2026-03-25,2026-03-27,57,https://us19.campaign-archive.com/?u=69b240eacdf74b2178df77d5b&id=69c05889bf
APIs Seguras vs. Velocidade de Entrega: Qual sua prioridade?,5b56480195,0.406,0.0256,2026-03-20,2026-03-27,241,https://us19.campaign-archive.com/?u=69b240eacdf74b2178df77d5b&id=5b56480195
Proteja suas APIs no Open Banking e impulsione sua receita,26583e3ef5,0.6,0.0,2026-03-24,2026-03-27,5,https://mailchi.mp/aiqon/id40a1brgn
Continuidade de Negócios: Proteção Essencial para Seus Dados SaaS,85a1863bdb,0.35479999999999995,0.0968,2026-03-24,2026-03-27,94,https://mailchi.mp/aiqon/olcx7jmkq7
Risco cibernético: Quanto custa para o seu EBITDA?,874bf00289,0.3018,0.053399999999999996,2026-03-25,2026-03-27,498,https://mailchi.mp/aiqon/ga8qow0kc4
BACEN à vista: sua instituição está preparada?,756318550f,0.2651,0.0605,2026-03-25,2026-03-27,349,https://mailchi.mp/aiqon/2mojswn6vk
TCU na mira? Automatize seus relatórios de conformidade,558b75ec0d,0.24239999999999998,0.0545,2026-03-27,2026-03-27,64,https://mailchi.mp/aiqon/c8cee9oex1
Parada na Linha de Produção: Qual o Prejuízo Real?,3c78bef6d0,0.2742,0.0323,2026-03-26,2026-03-27,171,https://mailchi.mp/aiqon/5yrukfcgta
Resiliência Essencial: Garanta a Proteção de Dados do seu Hospital.,24e0b51a5b,0.0,0.0,2026-02-04,2026-03-31,89,https://us19.campaign-archive.com/?u=69b240eacdf74b2178df77d5b&id=24e0b51a5b
BACEN te assusta? Simplifique a entrada no mercado financeiro,582b50daf6,0.0,0.0,2026-03-30,2026-03-31,18,https://mailchi.mp/aiqon/5qco7oa2zp
Atestados de Segurança: Sua Vantagem Competitiva em Negócios com o Setor Público,c4373e7f96,0.0,0.0,2026-03-31,2026-03-31,5,https://us19.campaign-archive.com/?u=69b240eacdf74b2178df77d5b&id=c4373e7f96
Pare de perder dinheiro com falsos positivos no seu SOC,f9b0459c92,0.0,0.0,2026-03-31,2026-03-31,119,https://us19.campaign-archive.com/?u=69b240eacdf74b2178df77d5b&id=f9b0459c92
Open Banking: Estratégias para Segurança API e Conformidade para Fintechs,5e7482d562,0.0,0.0,2026-01-04,2026-03-31,343,https://us19.campaign-archive.com/?u=69b240eacdf74b2178df77d5b&id=5e7482d562
Ransomware paralisando hospitais? Fuja dos backups furados!,7d3a8f815f,0.0,0.0,2026-03-31,2026-03-31,89,https://us19.campaign-archive.com/?u=69b240eacdf74b2178df77d5b&id=7d3a8f815f
Fintech Segura: Compliance e proteção de APIs,35c4e184b7,0.0,0.0,2026-03-31,2026-03-31,1,https://us19.campaign-archive.com/?u=69b240eacdf74b2178df77d5b&id=35c4e184b7
Destaque seu MSSP em editais governamentais de alto valor,c7b8fe57b8,0.0,0.0,2026-01-04,2026-03-31,5,https://us19.campaign-archive.com/?u=69b240eacdf74b2178df77d5b&id=c7b8fe57b8
Seu hospital está preparado para um resgate de dados EMERGENCIAL?,bd59bfef1c,0.209,0.0297,2026-03-04,2026-03-31,46,https://us19.campaign-archive.com/?u=69b240eacdf74b2178df77d5b&id=bd59bfef1c
CI/CD blindado: entregue Open Finance sem preocupações,00405d0425,0.2989,0.0115,2026-03-04,2026-03-31,235,https://us19.campaign-archive.com/?u=69b240eacdf74b2178df77d5b&id=00405d0425
TCU na mira? Evite responsabilização por falhas na LGPD.,1c30ab52cf,0.20379999999999998,0.0179,2026-02-04,2026-03-31,155,https://us19.campaign-archive.com/?u=69b240eacdf74b2178df77d5b&id=1c30ab52cf
Pare de perder horas com relatórios manuais de TI,ac55f898d6,,,2026-08-04,2026-04-13,802,https://us19.campaign-archive.com/?u=69b240eacdf74b2178df77d5b&id=ac55f898d6
Ransomware em Hospitais: Imutabilidade dos dados como escudo.,c30415ff2f,0.2191,0.0415,2026-07-04,2026-04-13,88,https://us19.campaign-archive.com/?u=69b240eacdf74b2178df77d5b&id=c30415ff2f
,adcc803a9d,0.20920000000000002,0.0131,2026-09-04,2026-04-13,793,https://us19.campaign-archive.com/?u=69b240eacdf74b2178df77d5b&id=adcc803a9d
,b8a50aad42,0.16,0.02,2026-07-04,2026-04-13,154,https://us19.campaign-archive.com/?u=69b240eacdf74b2178df77d5b&id=b8a50aad42
Cansado de auditorias longas e complexas?,a3b75dac26,0.2974,0.0733,2026-10-04,2026-04-13,64,https://mailchi.mp/aiqon/9v2retg674
RTO/RPO da sua instituição de saúde em risco?,a1d79ac944,0.1718,0.049100000000000005,2026-10-04,2026-04-13,50,https://mailchi.mp/aiqon/7jwwlofujb
Fintech Segura: Checklist de APIs para CI/CD,11bf931a6f,0.2586,0.0345,2026-10-04,2026-04-13,237,https://mailchi.mp/aiqon/9m5xf79we6
Ataques paralisantes: como hospitais podem evitar o caos?,c2e95a8efd,0.2651,0.0663,2026-09-04,2026-04-13,4,https://mailchi.mp/aiqon/b4nhl8g2ig
Pare de perder horas com relatórios manuais de TI,fccc1ea9f4,0.1718,0.049100000000000005,2026-08-04,2026-04-13,806,https://mailchi.mp/aiqon/ee1elcjqvf
Paradas na produção? Proteja as redes industriais dos seus clientes,e8044a27c8,0.4,0.0,2026-06-04,2026-04-13,6,https://mailchi.mp/aiqon/9s9qehcq5w
Setor Financeiro: Como garantir conformidade com o BACEN?,6b076487ef,0.25,0.0,2026-06-04,2026-04-13,18,https://mailchi.mp/aiqon/zl0lpgyac7
PMEs: Oportunidade ou dor de cabeça para sua revenda?,e5a7e24162,0.3593,0.039,2026-06-04,2026-04-13,713,https://mailchi.mp/aiqon/hy0pgtigdt
Open Banking: brechas na API podem ser a porta de entrada de ataques?,c75b94412b,0.2758,0.0526,2026-08-04,2026-04-13,4,https://mailchi.mp/aiqon/jnuyzs9fb6
Setor Financeiro na mira: APIs desprotegidas = Fraude!,1d76ee11e9,,,2026-07-04,2026-04-14,5,https://mailchi.mp/aiqon/2qkq7r5xxb
Redes OT/TI: Visibilidade Zero = Prejuízo Máximo?,726809179d,,,2026-08-04,2026-04-14,168,https://mailchi.mp/aiqon/mhgj12mogk
Seu SOC está sobrecarregado? Automatize!,592f5df461,,,2026-07-04,2026-04-14,123,https://mailchi.mp/aiqon/zr9dugxhzt
Patches te sobrecarregam? Automatize!,29e9c4d7ea,,,2026-04-16,2026-04-23,794,https://mailchi.mp/aiqon/e94odjyziy
Sua fábrica está vulnerável a paradas inesperadas?,7343f7dba8,,,2026-04-16,2026-04-23,167,https://mailchi.mp/aiqon/ssy7anloic
Não auditar seus sistemas pode custar caro. Veja por quê.,674fd03450,,,2026-04-22,2026-04-24,495,https://mailchi.mp/aiqon/1f6tbltayo
Proteja Suas APIs Financeiras Contra Ameaças Cibernéticas,b7384e9b06,,,2026-04-22,2026-04-24,342,https://us19.campaign-archive.com/?u=69b240eacdf74b2178df77d5b&id=b7384e9b06
Proteja seus Ambientes OT com Visibilidade Unificada,e2432f4b8e,,,2026-04-22,2026-04-24,60,https://mailchi.mp/aiqon/mt5gjybqcy
Não deixe a paralisia cibernética sabotar sua produção,c659e7f38a,,,2026-04-23,2026-04-24,166,https://mailchi.mp/aiqon/2ilye2p709
Lançar rápido vs. Segurança: Qual o custo?,ed2e760c11,,,2026-04-17,2026-04-24,237,https://mailchi.mp/aiqon/eh2q8q2hxm
RTO e RPO: Seu sistema está realmente protegido?,5bafdf1a50,,,2026-04-17,2026-04-24,50,https://mailchi.mp/aiqon/je34jye1im
Conformidade em 2026: Simplifique sua gestão de riscos com Netwrix Auditor,06d8fe3a9b,,,2026-04-23,2026-04-24,158,https://mailchi.mp/aiqon/319m8igtcn
"AIQON | *|FNAME|*, posso reservar o seu lugar?",775cb2b41e,0.267,0.0341,2026-01-29,2026-05-02,5357,https://mailchi.mp/aiqon/webinar-portfolio-2
